{"schema":"omarchygs.provider-compatibility-offer/v1","provider_id":"provider-example","release_id":"11111111-1111-4111-8111-111111111111","message_id":"22222222-2222-4222-8222-222222222222","supported":[{"protocol_version":1,"capabilities":["game.launch","game.command","game.reconcile","game.event"]}]}
